{
  "shot_id": "EP01_S03_SH001",
  "scene_id": "EP01_S03",
  "episode_id": "EP01",
  "duration": 13,
  "purpose": "천마총 외관·표지·입구",
  "era": "PRESENT_DAY",
  "location": "LOC_CHEONMACHONG_V01",
  "historical_confidence": "FACT",
  "camera_complexity": 20,
  "spatial_accuracy": 50,
  "human_motion": 10,
  "visual_importance": 70,
  "pipeline": "REAL_SHOOT",
  "status": "PLANNED",
  "characters": [],
  "costumes": [],
  "continuity_group": "EP01_S03",
  "master_frame": null,
  "must_keep": [],
  "camera_id": null,
  "prompt_id": null,
  "router_decision_id": null,
  "fact_ids": [],
  "rights_ids": [],
  "ai_label": null,
  "version_history": [],
  "approved_version": null,
  "created_at": "2026-09-11",
  "updated_at": "2026-09-11",
  "updated_by": "Claude Code (Continuity Engine)",
  "notes": "TC 1:25–1:38 (러프컷 v1 기준, 내레이션 녹음 후 조정). 촬영 허가 확인. 백업 A3 (CC BY-SA, YELLOW). 점수(camera_complexity 등)는 Continuity Engine 추정치 — P4 라우터에서 확정."
}
