{
  "shot_id": "EP01_S07_SH004",
  "scene_id": "EP01_S07",
  "episode_id": "EP01",
  "duration": 13,
  "purpose": "금관 디테일 홀드 (+ 질문 자막 1줄 선택)",
  "era": "SILLA_EARLY",
  "location": "LOC_GYEONGJU_NATIONAL_MUSEUM_V01",
  "historical_confidence": "FACT",
  "camera_complexity": 5,
  "spatial_accuracy": 10,
  "human_motion": 0,
  "visual_importance": 85,
  "pipeline": "ARCHIVE",
  "status": "PLANNED",
  "characters": [],
  "costumes": [],
  "continuity_group": "EP01_S07",
  "master_frame": null,
  "must_keep": [],
  "camera_id": null,
  "prompt_id": null,
  "router_decision_id": null,
  "fact_ids": [],
  "rights_ids": [],
  "ai_label": null,
  "version_history": [],
  "approved_version": null,
  "created_at": "2026-09-11",
  "updated_at": "2026-09-11",
  "updated_by": "Claude Code (Continuity Engine)",
  "notes": "TC 5:52–6:05 (러프컷 v1 기준, 내레이션 녹음 후 조정). 문장 뒤 0.5초 여백. [불일치 X3] 대본 v2 에는 관람객 REAL 컷과 금관 위치 단면 그래픽도 있으나 러프컷에는 없음. 점수(camera_complexity 등)는 Continuity Engine 추정치 — P4 라우터에서 확정."
}
