{
  "shot_id": "EP001_S04_SH003",
  "scene_id": "EP001_S04",
  "episode_id": "EP001",
  "duration": 8,
  "purpose": "elite burial preparation",
  "era": "SILLA_EARLY",
  "location": "LOC_GYEONGJU_BURIAL_SITE_V01",
  "historical_confidence": "PROBABLE",
  "camera_complexity": 55,
  "spatial_accuracy": 90,
  "human_motion": 45,
  "visual_importance": 85,
  "pipeline": "BLENDER_FLOW",
  "status": "PREVIZ_APPROVED",
  "characters": [
    "CHAR_SILLA_OFFICIAL_01"
  ],
  "costumes": [
    "COSTUME_SILLA_OFFICIAL_A01"
  ],
  "continuity_group": "EP001_S04",
  "master_frame": "EP001_S04_MASTER_V03",
  "must_keep": [
    "face_identity",
    "body_proportion",
    "hair",
    "costume",
    "height_ratio"
  ],
  "camera_id": "CAMERA_S004_V02",
  "prompt_id": "PRM_EP001_S04_SH003_V01",
  "router_decision_id": "RTR_EP001_S04_SH003_V01",
  "fact_ids": [
    "CLM_HWANGNYONGSA_TEMPLATE_001"
  ],
  "rights_ids": [],
  "ai_label": "AI Visual Reconstruction",
  "version_history": [
    {
      "version": "V01",
      "stage": "PREVIZ",
      "status": "PREVIOUS",
      "created_at": "2026-09-11",
      "created_by": "Blender Agent",
      "path": null,
      "note": "template"
    },
    {
      "version": "V02",
      "stage": "PREVIZ",
      "status": "PREVIOUS",
      "created_at": "2026-09-11",
      "created_by": "Blender Agent",
      "path": null,
      "note": "template"
    },
    {
      "version": "V03",
      "stage": "PREVIZ",
      "status": "APPROVED",
      "created_at": "2026-09-11",
      "created_by": "Blender Agent",
      "path": null,
      "note": "template"
    }
  ],
  "approved_version": "V03",
  "created_at": "2026-09-11",
  "updated_at": "2026-09-11",
  "updated_by": "Claude Code",
  "notes": "TEMPLATE EXAMPLE — EP001_HWANGNYONGSA is not the active episode."
}
